{
  "id": "math.g3.m5.l1",
  "subject": "math",
  "grade": 3,
  "level": "lesson",
  "title": "Unit fractions: one part of a whole",
  "parent_id": "math.g3.m5",
  "order": 1,
  "prerequisites": [],
  "objectives": ["Partition a whole into equal parts and name one part as a unit fraction."],
  "source": {
    "name": "EngageNY Mathematics",
    "url": "https://archive.org/download/engageny-mathematics",
    "license": "CC BY-NC-SA"
  }
}
